{
  "research_question": "在大学高等数学课程中，护栏式 AI Tutor（只给提示不给答案）是否能在保持/提升参与度的同时，提高（或至少不损害）独立解题能力与概念理解，且不增加 AI 依赖？",
  "groups": {
    "treatment": "使用 4 阶段护栏式 AI Tutor 政策的教学班",
    "comparison": "匹配教学班：不使用 AI Tutor，仅传统教材+习题课（同教师同材料）"
  },
  "baseline": "第 1 周无 AI 独立解题基线测验（概念理解 + 独立解题 + 完成时间）",
  "post_test": "第 8 周无 AI 环境下的独立考试（概念理解与独立解题）",
  "retention_test": "第 14-16 周（期末或延迟 4-8 周）无 AI 保持测验",
  "transfer_test": "第 8 周新增题型（未在练习中出现、需迁移运用）的无 AI 迁移任务",
  "process_metrics": [
    "每周练习完成率",
    "AI Tutor 使用日志：求助次数、提示类型、每次求助前的独立尝试时长",
    "求助类型分类（实质求助 vs 答案抄写）",
    "反思记录提交率与质量评分"
  ],
  "learning_metrics": [
    "无 AI 独立考试成绩（独立解题）",
    "概念理解测验得分",
    "保持测验得分（retention）",
    "迁移任务得分（transfer）",
    "练习任务表现（单独报告，不与学习指标混同）"
  ],
  "risk_metrics": [
    "AI 依赖指标（求助后能否独立复现解题过程）",
    "过度依赖（求助频率高于阈值、独立尝试时长过短）",
    "虚假信心（测验前自评信心 vs 实际得分差异）",
    "学术诚信违规（直接复制 Tutor 输出）次数"
  ],
  "analysis_plan": "预注册的基线校正比较（ANCOVA）：treatment vs comparison 在无 AI 独立考试、保持测验、迁移任务上的差异；练习任务表现单独建模并明确标注为 task performance，不与学习效应混同；按学生先验水平与求助行为做亚组分析；在第 3、5、7 周检查停止条件。",
  "success_threshold": "治疗组在无 AI 独立考试与迁移任务上不劣于对照组（差距 ≤5%）且概念理解不降，同时参与度（engagement）显著高于对照组、AI 依赖指标低于阈值；若无 AI 独立解题下降 >10%，无论练习表现多好均判试点失败。",
  "stop_conditions": [
    "无 AI 独立考试或迁移任务较对照下降 >10%",
    "学术诚信违规出现在 >20% 的提交中",
    "AI 依赖指标连续两周超阈值",
    "教学负担不可持续"
  ]
}
